{
  "backend": "ollama",
  "backend_version": "0.32.14",
  "cpu": "Intel64 Family 6 Model 154 Stepping 4, GenuineIntel",
  "date": "2026-08-20T18:04:52-03:00",
  "duration_s": 5.946,
  "generated_tokens": 120,
  "min_free_ram_gb": 0.015,
  "model": "qwen2.5:1.5b",
  "os": "Windows-11-10.0.26200-SP0",
  "paged": true,
  "peak_pagefile_gb": 16.581,
  "prompt_id": "lowrambench-v1-fixed-120",
  "quantization": "Q4_K_M",
  "ram_total_gb": 7.681,
  "schema_version": "2.0",
  "size_gb": 0.918,
  "status": "completed",
  "tok_s": 20.181
}
